image1,image2,name,summery
https://st.hzcdn.com/simgs/6991c57d0f9cec5e_9-2946,https://st.hzcdn.com/simgs/80d19bc00f9cec5f_9-2946,Pemberly Row Wood Dining Swivel Counter Stools in Distressed Gray (Set of 2),
https://st.hzcdn.com/simgs/4451a29c080a7f73_9-7543,https://st.hzcdn.com/simgs/171164d9080a7f74_9-7543,"Colter Leather Dining Arm Chair with Steel Legs, Black",
https://st.hzcdn.com/simgs/828106e40b046a2f_9-5612/home-design.jpg,,"Hannah Velvet Dining Chairs, Set of 2, Black",
https://st.hzcdn.com/simgs/90c122ff058aa89e_9-1960/home-design.jpg,,Baxton Studio Marquis Tan Microfiber Club Chair,
https://st.hzcdn.com/simgs/559115010c378f87_9-9378,https://st.hzcdn.com/simgs/10311f450c378f89_9-6966,"Paloma Cognac Velvet Accent Chair, Cognac",
https://st.hzcdn.com/simgs/16a17ef50f9068fe_9-2086,https://st.hzcdn.com/simgs/5201ffb10f9068ff_9-3657,"GDF Studio Oliver Farmhouse Armchair, Green Checkerboard/Dark Brown",
https://st.hzcdn.com/simgs/adc12773025c7ac3_9-1213/home-design.jpg,,"Boheme Leather Chair, Optic White, Set of 2",
https://st.hzcdn.com/simgs/46b13b4a07169133_9-3031,https://st.hzcdn.com/simgs/389106e507169138_9-3031,Glacier Country Collection Side Chair With Ergonomic Wooden Seat,
https://st.hzcdn.com/simgs/3a2144320d0d2e19_9-8773,https://st.hzcdn.com/simgs/006140ec0d0d2e1a_9-6128,"West Palm Living Room Accent Chair in Rustic Oak, Beige",
https://st.hzcdn.com/simgs/bd7125350c34df55_9-7320,https://st.hzcdn.com/simgs/6dd1186e0c34df57_9-7320,"Peyton Accent Chair, Vintage Midnight",
https://st.hzcdn.com/simgs/bbd1bc8b0ae90006_9-2171,https://st.hzcdn.com/simgs/bf9182580ae90009_9-2171,"Karina Velvet Dining Chairs, Set of 2, Pink, Gold Base",
https://st.hzcdn.com/simgs/4041c32c0b1051d4_9-9686,https://st.hzcdn.com/simgs/2d61e5af0b1051d7_9-0076,"Modern Dining Chairs Wood Armchairs, Set of 2, Natural",
https://st.hzcdn.com/simgs/e1f1ccd70f931da2_9-3542,https://st.hzcdn.com/simgs/a4010a920f931da3_9-3709,"Victoria Modern Dining Chair With Beech Wood Legs, Set of 2",
https://st.hzcdn.com/simgs/38f195490ae8fffe_9-9568,https://st.hzcdn.com/simgs/b6b1b8190ae90000_9-7498,"Giselle Velvet Dining Chairs, Set of 2, Pink, Gold Base",
https://st.hzcdn.com/simgs/188158de05b01de2_9-0281,https://st.hzcdn.com/simgs/4351474205b01de6_9-0281,"Sienna Leather Dining Chair, Matte Ochre",
https://st.hzcdn.com/simgs/46e12cae0db1c272_9-7309,https://st.hzcdn.com/simgs/af81daab0db1c274_9-7403,"Nikki Velvet Dining Chairs, Set of 2, Navy",
https://st.hzcdn.com/simgs/a6b1f4cf0e828e85_9-1240,https://st.hzcdn.com/simgs/93a1c8d50e828e87_9-1240,"Ruth Dining Chairs, Set of 2, Green",
https://st.hzcdn.com/simgs/b35171640ebdba8d_9-7309,https://st.hzcdn.com/simgs/3441561c0ebdba8c_9-7309,Madison Park Elmwood Dining Chair Set of 2,
https://st.hzcdn.com/simgs/5fc163b90e966d30_9-0939,https://st.hzcdn.com/simgs/6471ad000e966d2a_9-0939,"Larisa Barrel Chair, Tropical",
https://st.hzcdn.com/simgs/4ab1269a09d67c31_9-7911,https://st.hzcdn.com/simgs/68c1359109d67c32_9-7911,Monarch Faux Leather Accent Chair in Black,
https://st.hzcdn.com/simgs/3ef1f4c20ee14115_9-8208,https://st.hzcdn.com/simgs/31e131210ee14119_9-8208,"Geometric Gold Metal Dining Chair, 20""x36""",
https://st.hzcdn.com/simgs/219136950e828eee_9-5117,https://st.hzcdn.com/simgs/46d1cc7b0e828ef1_9-5117,"Grand Club Chair, Light Gray",
https://st.hzcdn.com/simgs/2941349f0f35d739_9-1480,https://st.hzcdn.com/simgs/8de155180f35d731_9-3899,"CosmoLiving Ellis Modern Metal Accent Chair, Blush Pink",
https://st.hzcdn.com/simgs/b2e118a00ae8ffdb_9-2139,https://st.hzcdn.com/simgs/de01630b0af36b94_9-3738,"Suri Velvet Dining Chairs, Set of 2, Black",
https://st.hzcdn.com/simgs/b5d128bb0fda3577_9-6298,https://st.hzcdn.com/simgs/384134580fda357a_9-6298,"Shell Chair, White",
https://st.hzcdn.com/simgs/3e31a7a50e3adcd0_9-2175,https://cf-images.us-east-1.prod.boltdns.net/v1/jit/4186268161001/9c9028b1-7e44-4522-a092-4914ce85bce0/main/300x300/15s40ms/match/image.jpg,"Gerald Mid-Century Modern Tufted Wingback Armchair, Forest Green Velvet",
https://st.hzcdn.com/simgs/61d1e4940f9316b8_9-7437,https://st.hzcdn.com/simgs/21019c0a0f9316b9_9-3590,"GDF Studio Lexia Classic Slate Microfiber Dining Chair, Set of 2",
https://st.hzcdn.com/simgs/e991ce2f07102df0_9-5562,https://st.hzcdn.com/simgs/1671e4ab07102df1_9-8135,Savonarola Chair,
https://st.hzcdn.com/simgs/8c31a0090bfcf033_9-7866,https://st.hzcdn.com/simgs/3f51bce80bfcf035_9-7866,"Offex Living Room Upholstered Leather Arm Chair, Black",
https://st.hzcdn.com/simgs/86316f3009960c27_9-3442,https://st.hzcdn.com/simgs/22414f1709960c28_9-3442,"Opera Velvet Accent Chair, Navy",
https://st.hzcdn.com/simgs/7ed1a70f0d3f1d44_9-1575,https://st.hzcdn.com/simgs/ed51690b0d3f1e6e_9-1575,"Compamia Carmen Dining Chairs, Set of 2, White and Transparent Amber",
https://st.hzcdn.com/simgs/ae0176cc0efca6ad_9-2196,https://st.hzcdn.com/simgs/dc21d4360efca6ae_9-2196,"Noah Velvet Accent Chair, Cognac, Gold Base",
https://st.hzcdn.com/simgs/0a7128070d8a4703_9-8900,https://st.hzcdn.com/simgs/edd197290d8a470c_9-8900,"Royce Accent Chair, Garnet Rose",
https://st.hzcdn.com/simgs/4b1110470c34dff8_9-5130,https://st.hzcdn.com/simgs/bce1360a0c34dffa_9-5130,"Valencia Bonded Leather Chair, Set of 2, Black",
https://st.hzcdn.com/simgs/4221dc6f0b1051d3_9-3225,https://st.hzcdn.com/simgs/1541cabc0b1051d4_9-0076,"Modern Dining Chairs Wood Armchairs, Set of 2, White",
https://st.hzcdn.com/simgs/93d1221c0e6f1fcf_9-7320,https://cf-images.us-east-1.prod.boltdns.net/v1/jit/4186268161001/8af93098-7318-4fa3-a155-6dad5f02d648/main/300x300/17s269ms/match/image.jpg,"INK+IVY Nola Dining Chairs, Set of 2",
https://st.hzcdn.com/simgs/7991f9c60d3f1428_9-8327,https://st.hzcdn.com/simgs/53314d500d3f1425_9-0638,"Carwyn Accent chair With Footstool, Blue Woven",
https://st.hzcdn.com/simgs/98a1030d0d53d675_9-9684,https://st.hzcdn.com/simgs/b351b0930d53d646_9-9684,Divani Casa Carlos Modern Gray Velvet and Gold Accent Chair,
https://st.hzcdn.com/simgs/743142e90e3ddea5_9-4579,https://st.hzcdn.com/simgs/fd6153910e3313da_9-4579,"Perception Tufted Upholstered Fabric Armchair, White",
https://st.hzcdn.com/simgs/49c10a0a0dd80024_9-8582,https://st.hzcdn.com/simgs/e5c1ceee0dd8002a_9-8582,"Tori Velvet Chair, Black",
https://st.hzcdn.com/simgs/bba175200810ebb7_9-6865,https://st.hzcdn.com/simgs/937154380810ebba_9-3943,"Capri Wood Dining Chair, Solid Bleech Wenge Base, White Ppm",
https://st.hzcdn.com/simgs/22e1b5950d2f697b_9-4404,https://st.hzcdn.com/simgs/cb516be20d4450aa_9-4404,"Armless Accent Chair, Brown Faux Leather",
https://st.hzcdn.com/simgs/0c41ce3e0eb4e5ce_9-0032,https://st.hzcdn.com/simgs/7d013eec0eb4e5cf_9-0032,Modway Prospect Channel Tufted Velvet Armchair in Gray (Set of 2),
https://st.hzcdn.com/simgs/1a91b6b10e9d6a05_9-1413/home-design.jpg,,"Upholstered Vinyl Accent Chair, Blue",
https://st.hzcdn.com/simgs/2f41cd7c0e72fd99_9-6453,https://st.hzcdn.com/simgs/d501a1fd0a836bf3_9-7267,Madison Park Kari Slant Back Wood Accent Chair,
https://st.hzcdn.com/simgs/b4a13c0b0c819274_9-7391,https://st.hzcdn.com/simgs/5781b4ec0c81926c_9-7391,Collin Arm Chair,
https://st.hzcdn.com/simgs/7cb149750fb4bba0_9-9261,https://st.hzcdn.com/simgs/600105510fb4bba1_9-9261,Flash Furniture Hercules Diplomat Leather Chair in Black,
https://st.hzcdn.com/simgs/50d1514c0dcb1f26_9-5884,https://st.hzcdn.com/simgs/8101ea410dcb1f27_9-5884,Magnolia Navy Chair With Silver Base,
https://st.hzcdn.com/simgs/5ed1d5710c34e0f6_9-7696,https://st.hzcdn.com/simgs/4ff1e1b70c34e0f9_9-5182,"Beverly Hills Bonded Leather Chairs With Driftwood Legs, Set of 2, Vintage Gray",
